{
  "contractVersion": "0.1.0",
  "publicationMode": "source-only",
  "nodes": [
    {
      "id": "urn:ghostmesh-readers:reader:the-inbox-was-a-boundary",
      "type": "Reader",
      "visibility": "public",
      "epistemicStatus": "source-editorial",
      "label": "The Inbox Was a Boundary",
      "url": "https://youtube.shareplane.malott.ai/the-inbox-was-a-boundary/",
      "source": {
        "path": "site/the-inbox-was-a-boundary/index.html",
        "sha256": "1b06285bf592203ebaf08ca058bd8471019f97bf96f5eefa43ae2b08909e69ee"
      }
    },
    {
      "id": "urn:ghostmesh-readers:claim:fleet-activity-reported",
      "type": "Claim",
      "visibility": "public",
      "epistemicStatus": "attributed-report",
      "label": "Fleet activity",
      "statement": "Reports more than 2,600 Amap extraction attempts from September 28 to October 8; methods and outcomes vary.",
      "provenance": {
        "sourceNodeId": "urn:ghostmesh-readers:reader:the-inbox-was-a-boundary",
        "locator": "#fleet-activity-source",
        "sourceFileSha256": "1b06285bf592203ebaf08ca058bd8471019f97bf96f5eefa43ae2b08909e69ee",
        "quoteSha256": "846ff5ff13d32b94826d855429ca96ab02c922f5bf353fe426d6df57dfd28743"
      }
    },
    {
      "id": "urn:ghostmesh-readers:source:4e71c69390cd1baf",
      "type": "EvidenceSource",
      "visibility": "public",
      "epistemicStatus": "external-primary-report",
      "label": "Swarmchasers full report",
      "url": "https://swarmcha.se/posts/chinese-agent-fleet-full-report",
      "urlSha256": "4e71c69390cd1bafdc69ed196b101436991430038281b3b8fa969165ce61553b",
      "contentSha256": null
    },
    {
      "id": "urn:ghostmesh-readers:reader:a-challenge-is-not-a-verdict",
      "type": "Reader",
      "visibility": "public",
      "epistemicStatus": "source-editorial",
      "label": "A Challenge Is Not a Verdict",
      "url": "https://youtube.shareplane.malott.ai/a-challenge-is-not-a-verdict/",
      "source": {
        "path": "site/a-challenge-is-not-a-verdict/index.html",
        "sha256": "094d8626ea2dca23e8bd971dd86e10f00c04525c8990888a7fd3c4c4c7ff5dbc"
      }
    },
    {
      "id": "urn:ghostmesh-readers:reader:ask-for-the-outcome-keep-the-boundary",
      "type": "Reader",
      "visibility": "public",
      "epistemicStatus": "source-editorial",
      "label": "Ask for the Outcome. Keep the Boundary",
      "url": "https://youtube.shareplane.malott.ai/ask-for-the-outcome-keep-the-boundary/",
      "source": {
        "path": "site/ask-for-the-outcome-keep-the-boundary/index.html",
        "sha256": "1b1eaf4655fe2734c6b26f230a887db4a20b0f67834c043fd3cc3c760c388dd3"
      }
    },
    {
      "id": "urn:ghostmesh-readers:reader:autonomy-needs-an-interface",
      "type": "Reader",
      "visibility": "public",
      "epistemicStatus": "source-editorial",
      "label": "Autonomy Needs an Interface",
      "url": "https://youtube.shareplane.malott.ai/autonomy-needs-an-interface/",
      "source": {
        "path": "site/autonomy-needs-an-interface/index.html",
        "sha256": "3cc9993cc84d6b08e4ecf80e1f26a91334ea45555859f2e94398040253472bab"
      }
    },
    {
      "id": "urn:ghostmesh-readers:reader:make-good-work-inspectable",
      "type": "Reader",
      "visibility": "public",
      "epistemicStatus": "source-editorial",
      "label": "Make Good Work Inspectable",
      "url": "https://youtube.shareplane.malott.ai/make-good-work-inspectable/",
      "source": {
        "path": "site/make-good-work-inspectable/index.html",
        "sha256": "f528fb5d8477a264335c63e2b03c8f79ecd29e0b66c5d0e16ab9ef4a46ab9c90"
      }
    },
    {
      "id": "urn:ghostmesh-readers:reader:the-agent-a-company-owns",
      "type": "Reader",
      "visibility": "public",
      "epistemicStatus": "source-editorial",
      "label": "The Agent a Company Owns",
      "url": "https://youtube.shareplane.malott.ai/the-agent-a-company-owns/",
      "source": {
        "path": "site/the-agent-a-company-owns/index.html",
        "sha256": "eccbaf86113487687b3ccf3534f446c1ba65e84743a431883662f3f89e314894"
      }
    },
    {
      "id": "urn:ghostmesh-readers:reader:the-funnel-is-not-the-frontier",
      "type": "Reader",
      "visibility": "public",
      "epistemicStatus": "source-editorial",
      "label": "The Funnel Is Not the Frontier",
      "url": "https://youtube.shareplane.malott.ai/the-funnel-is-not-the-frontier/",
      "source": {
        "path": "site/the-funnel-is-not-the-frontier/index.html",
        "sha256": "f13f886d5de64cdf31fe4217426e0d79f337c70c1c8f6f98293a0413748f0d76"
      }
    },
    {
      "id": "urn:ghostmesh-readers:reader:the-key-was-the-boundary",
      "type": "Reader",
      "visibility": "public",
      "epistemicStatus": "source-editorial",
      "label": "The Key Was the Boundary",
      "url": "https://youtube.shareplane.malott.ai/the-key-was-the-boundary/",
      "source": {
        "path": "site/the-key-was-the-boundary/index.html",
        "sha256": "618064f389addad6f57972df5421544d84dd5bce493bc14d187f00f3a9e4ba51"
      }
    },
    {
      "id": "urn:ghostmesh-readers:reader:the-microscope-is-not-a-soul",
      "type": "Reader",
      "visibility": "public",
      "epistemicStatus": "source-editorial",
      "label": "The Microscope Is Not a Soul",
      "url": "https://youtube.shareplane.malott.ai/the-microscope-is-not-a-soul/",
      "source": {
        "path": "site/the-microscope-is-not-a-soul/index.html",
        "sha256": "4fdcb9d4a374633ead2d746170218b3ad062416585dae433fa73c79a42d24de4"
      }
    },
    {
      "id": "urn:ghostmesh-readers:reader:the-scan-never-reached-the-login",
      "type": "Reader",
      "visibility": "public",
      "epistemicStatus": "source-editorial",
      "label": "The Scan Never Reached the Login",
      "url": "https://youtube.shareplane.malott.ai/the-scan-never-reached-the-login/",
      "source": {
        "path": "site/the-scan-never-reached-the-login/index.html",
        "sha256": "6148e2bdbd9b87f5a88069a10d261302135ce014b3449908650a5dcbdc67b5d6"
      }
    },
    {
      "id": "urn:ghostmesh-readers:reader:the-score-is-not-the-system",
      "type": "Reader",
      "visibility": "public",
      "epistemicStatus": "source-editorial",
      "label": "The score is not the system",
      "url": "https://youtube.shareplane.malott.ai/the-score-is-not-the-system/",
      "source": {
        "path": "site/the-score-is-not-the-system/index.html",
        "sha256": "cf4717525821db148b1e0a7d475f5ae04473c7e60a4f71024a3cb87be2ec2568"
      }
    },
    {
      "id": "urn:ghostmesh-readers:reader:when-agents-become-the-customer",
      "type": "Reader",
      "visibility": "public",
      "epistemicStatus": "source-editorial",
      "label": "When Agents Become the Customer",
      "url": "https://youtube.shareplane.malott.ai/when-agents-become-the-customer/",
      "source": {
        "path": "site/when-agents-become-the-customer/index.html",
        "sha256": "3bbe2da9cbb1d1d42b931264ca77b0e5a4821269d902d8819247dbfdcfd55bd0"
      }
    },
    {
      "id": "urn:ghostmesh-readers:reader:when-software-becomes-legible",
      "type": "Reader",
      "visibility": "public",
      "epistemicStatus": "source-editorial",
      "label": "When software becomes legible",
      "url": "https://youtube.shareplane.malott.ai/when-software-becomes-legible/",
      "source": {
        "path": "site/when-software-becomes-legible/index.html",
        "sha256": "d8f33e462019ee00f4cd36a48f68b38c3dcdede7985d25a30cf95cfeb8d7c501"
      }
    },
    {
      "id": "urn:ghostmesh-readers:reader:the-fleet-does-not-prove-the-forecast",
      "type": "Reader",
      "visibility": "public",
      "epistemicStatus": "source-editorial",
      "label": "The Fleet Does Not Prove the Forecast",
      "url": "https://youtube.shareplane.malott.ai/the-fleet-does-not-prove-the-forecast/",
      "source": {
        "path": "site/the-fleet-does-not-prove-the-forecast/index.html",
        "sha256": "c09ae4b42b466ef312d75f4aa580d37774595ad064d915473090db6b040c9f41"
      }
    },
    {
      "id": "urn:ghostmesh-readers:reader:a-scenario-is-not-a-singularity",
      "type": "Reader",
      "visibility": "public",
      "epistemicStatus": "source-editorial",
      "label": "A Scenario Is Not a Singularity",
      "url": "https://youtube.shareplane.malott.ai/a-scenario-is-not-a-singularity/",
      "source": {
        "path": "site/a-scenario-is-not-a-singularity/index.html",
        "sha256": "a03c2b476f94ad3f716f19c7b60d019b39bf25bdb5a02a8c2cbed0979e21df85"
      }
    },
    {
      "id": "urn:ghostmesh-readers:reader:the-test-must-name-its-target",
      "type": "Reader",
      "visibility": "public",
      "epistemicStatus": "source-editorial",
      "label": "The Test Must Name Its Target",
      "url": "https://youtube.shareplane.malott.ai/the-test-must-name-its-target/",
      "source": {
        "path": "site/the-test-must-name-its-target/index.html",
        "sha256": "dd354815c8822902aa177d883557065170b5cc89bc9ca626b8ccdd11e7bbdc62"
      }
    },
    {
      "id": "urn:ghostmesh-readers:reader:the-parallel-result-is-not-the-product",
      "type": "Reader",
      "visibility": "public",
      "epistemicStatus": "source-editorial",
      "label": "The Parallel Result Is Not the Product",
      "url": "https://youtube.shareplane.malott.ai/the-parallel-result-is-not-the-product/",
      "source": {
        "path": "site/the-parallel-result-is-not-the-product/index.html",
        "sha256": "62b63242ab18d25697588aec3ec9432f62bf7f2905d434cdc91ab7503f7eae93"
      }
    },
    {
      "id": "urn:ghostmesh-readers:reader:the-experiment-ran-did-the-research-advance",
      "type": "Reader",
      "visibility": "public",
      "epistemicStatus": "source-editorial",
      "label": "The Experiment Ran. Did the Research Advance?",
      "url": "https://youtube.shareplane.malott.ai/the-experiment-ran-did-the-research-advance/",
      "source": {